{
  "case_id": "giflib-5.1.2-cve-2016-3977",
  "target": {
    "project": "giflib",
    "version": "5.1.2",
    "source_root": "/home/li/skillclaw-eval/giflib-5.1.2",
    "binary": "util/gif2rgb",
    "build": "Build giflib 5.1.2 from source on the remote VM. The vulnerable utility is util/gif2rgb."
  },
  "blind_workspace": {
    "agent_root": "/home/li/skillclaw-eval/blind_workspaces/giflib-5.1.2-cve-2016-3977",
    "oracle_only_paths": [
      "artifacts/poc-cve-2016-3977.gif",
      "artifacts/run_giflib_poc.sh",
      "poc-cve-2016-3977.gif"
    ],
    "neutral_artifacts": [
      {
        "path": "samples/sample_1.gif",
        "description": "Neutral crafted GIF input without CVE-labelled filename."
      }
    ],
    "setup_commands": [
      "mkdir -p samples",
      "python3 \"$SKILLCLAW_REPO_ROOT\"/benchmarks/confirmations/giflib-5.1.2-cve-2016-3977/generate_confirmation_input.py samples/sample_1.gif"
    ]
  },
  "ground_truth": {
    "cves": [
      "CVE-2016-3977"
    ],
    "files": [
      "util/gif2rgb.c"
    ],
    "functions": [
      "DumpScreen2RGB"
    ],
    "vulnerability_type": "heap-based buffer overflow / out-of-bounds color-map access",
    "root_cause": "gif2rgb initializes the screen buffer with GifFile->SBackGroundColor without validating that the background color index is within ColorMap->ColorCount, then DumpScreen2RGB uses GifRow[j] as an index into ColorMap->Colors",
    "required_evidence": [
      "GifFile->SBackGroundColor",
      "ScreenBuffer[0][i]",
      "DumpScreen2RGB",
      "ColorMap->Colors[GifRow[j]]",
      "ColorMap->ColorCount"
    ],
    "references": [
      {
        "label": "NVD CVE-2016-3977",
        "url": "https://nvd.nist.gov/vuln/detail/CVE-2016-3977"
      },
      {
        "label": "CVE Record CVE-2016-3977",
        "url": "https://www.cve.org/CVERecord?id=CVE-2016-3977"
      },
      {
        "label": "Debian Security Tracker CVE-2016-3977",
        "url": "https://security-tracker.debian.org/tracker/CVE-2016-3977"
      },
      {
        "label": "giflib 5.1.2 mirror tag",
        "url": "https://github.com/nesbox/giflib/tree/5.1.2"
      }
    ]
  },
  "expected_artifacts": [
    {
      "name": "giflib-poc-input",
      "path": "artifacts/poc-cve-2016-3977.gif",
      "type": "binary",
      "description": "A minimal GIF trigger that exercises the background-color index overflow path."
    },
    {
      "name": "giflib-repro-script",
      "path": "artifacts/run_giflib_poc.sh",
      "type": "shell",
      "description": "A runnable reproduction helper that invokes the target binary against the generated GIF."
    }
  ],
  "repro": {
    "build": [
      "test -x util/gif2rgb_asan || gcc -Ilib -Iutil -g -O0 -fno-omit-frame-pointer -fsanitize=address util/gif2rgb.c util/getarg.c util/qprintf.c lib/dgif_lib.c lib/egif_lib.c lib/gifalloc.c lib/gif_err.c lib/gif_font.c lib/gif_hash.c lib/quantize.c lib/openbsd-reallocarray.c -lm -o util/gif2rgb_asan"
    ],
    "run": [
      "python3 \"$SKILLCLAW_REPO_ROOT\"/benchmarks/confirmations/giflib-5.1.2-cve-2016-3977/generate_confirmation_input.py artifacts/poc-cve-2016-3977.gif",
      "ASAN_OPTIONS=abort_on_error=1:symbolize=1 ./util/gif2rgb_asan -1 -o /tmp/giflib-cve-2016-3977.rgb artifacts/poc-cve-2016-3977.gif"
    ],
    "success_markers": [
      "AddressSanitizer",
      "heap-buffer-overflow",
      "DumpScreen2RGB"
    ],
    "target_frames": [
      "util/gif2rgb.c",
      "DumpScreen2RGB"
    ],
    "notes": "Use a minimal GIF that reproduces the background-color index path under ASan."
  },
  "confirmation": {
    "maturity": "asan-backed",
    "current_claim": "The generated GIF reliably triggers an AddressSanitizer heap-buffer-overflow on the gif2rgb path and reaches DumpScreen2RGB in the crashing trace.",
    "target_claim": "This case is already aligned with its intended ASan-backed confirmation goal. Future work should preserve reproducibility rather than seek a stronger confirmation tier.",
    "confirmed_path": {
      "summary": "ASan-backed confirmation through a crafted GIF that drives gif2rgb into the vulnerable background-color index path.",
      "markers": [
        "AddressSanitizer",
        "heap-buffer-overflow",
        "DumpScreen2RGB"
      ],
      "stack_frames": [
        "util/gif2rgb.c",
        "DumpScreen2RGB"
      ]
    },
    "promotion_blockers": [
      "No methodological blocker remains; the main requirement is reproducibility across rebuilds and environment refreshes."
    ],
    "promotion_targets": [
      "Keep the current ASan-backed reproducer stable across future rebuilds."
    ]
  },
  "benchmark": {
    "maturity": "current",
    "benchmark_tier": "publication-ready",
    "include_in_current_runs": true,
    "publication_ready": true,
    "primary_evidence": "asan-backed",
    "promotion_requirements": [
      "Keep the current ASan-backed reproducer stable across future rebuilds and environment refreshes."
    ],
    "notes": "Strong end-to-end confirmation case suitable for the current publication-ready subset."
  },
  "validators": [
    {
      "name": "agent-output-ground-truth-match",
      "type": "content_match",
      "allow_failure": true
    },
    {
      "name": "ground-truth-source-location",
      "type": "source_contains",
      "file": "util/gif2rgb.c",
      "patterns": [
        "DumpScreen2RGB",
        "GifFile->SBackGroundColor",
        "ScreenBuffer[0][i]",
        "ColorMap->Colors[GifRow[j]]"
      ]
    },
    {
      "name": "gif2rgb-binary-present",
      "type": "command",
      "command": "file util/gif2rgb && ./util/gif2rgb -h 2>&1 | head -20",
      "timeout_seconds": 20,
      "allow_failure": true
    },
    {
      "name": "generated-poc-input-exists",
      "type": "artifact_exists",
      "path": "artifacts/poc-cve-2016-3977.gif",
      "min_size_bytes": 20
    },
    {
      "name": "generated-poc-input-executes",
      "type": "artifact_exec",
      "path": "artifacts/run_giflib_poc.sh",
      "exec_mode": "bash",
      "success_markers": [
        "AddressSanitizer",
        "heap-buffer-overflow",
        "DumpScreen2RGB"
      ],
      "expect_crash": true,
      "timeout_seconds": 60
    },
    {
      "name": "asan-poc-cve-2016-3977",
      "type": "asan_command",
      "command": "python3 \"$SKILLCLAW_REPO_ROOT\"/benchmarks/confirmations/giflib-5.1.2-cve-2016-3977/generate_confirmation_input.py artifacts/poc-cve-2016-3977.gif && (test -x util/gif2rgb_asan || gcc -Ilib -Iutil -g -O0 -fno-omit-frame-pointer -fsanitize=address util/gif2rgb.c util/getarg.c util/qprintf.c lib/dgif_lib.c lib/egif_lib.c lib/gifalloc.c lib/gif_err.c lib/gif_font.c lib/gif_hash.c lib/quantize.c lib/openbsd-reallocarray.c -lm -o util/gif2rgb_asan) && ASAN_OPTIONS=abort_on_error=1:symbolize=1 ./util/gif2rgb_asan -1 -o /tmp/giflib-cve-2016-3977.rgb artifacts/poc-cve-2016-3977.gif",
      "timeout_seconds": 60,
      "sanitizer_markers": [
        "AddressSanitizer",
        "heap-buffer-overflow",
        "SEGV"
      ],
      "expected_stack_patterns": [
        "util/gif2rgb.c",
        "DumpScreen2RGB"
      ],
      "note": "Generates a 20-byte GIF with a two-entry global color table and out-of-range background index 2, then runs ASan gif2rgb."
    }
  ],
  "prompt": {
    "recommended_skillclaw": "Do not use WebSearch. The current working directory is giflib-5.1.2 and the target utility is util/gif2rgb. Use SkillClaw server-side skills, but do not invoke Claude Code local Skill(...). Analyze this giflib version for a known heap-based buffer overflow involving the GIF background color index and color-map lookup. Inspect source code and build artifacts. Finish with exactly one JSON object containing predicted_cves, predicted_files, predicted_functions, root_cause, evidence, and confidence.",
    "recommended_direct": "Do not use WebSearch. Do not use any skill. The current working directory is giflib-5.1.2 and the target utility is util/gif2rgb. Analyze this giflib version for a known heap-based buffer overflow involving the GIF background color index and color-map lookup. Inspect source code and build artifacts. Finish with exactly one JSON object containing predicted_cves, predicted_files, predicted_functions, root_cause, evidence, and confidence.",
    "recommended_blind_skillclaw": "Do not use WebSearch. The current working directory is a blind evaluation workspace for giflib-5.1.2 and the target utility is util/gif2rgb. Use SkillClaw server-side skills, but do not invoke Claude Code local Skill(...). Analyze this target for a memory-safety vulnerability that can be demonstrated with a crafted GIF input. You may inspect source code, normal build outputs, and neutral sample files that are already present in the workspace, but do not assume any hidden oracle or confirmation artifact exists. Identify the most plausible vulnerable file, function, root cause, and supporting evidence. Finish with exactly one JSON object containing predicted_cves, predicted_files, predicted_functions, root_cause, evidence, and confidence.",
    "recommended_blind_direct": "Do not use WebSearch. Do not use any skill. The current working directory is a blind evaluation workspace for giflib-5.1.2 and the target utility is util/gif2rgb. Analyze this target for a memory-safety vulnerability that can be demonstrated with a crafted GIF input. You may inspect source code, normal build outputs, and neutral sample files that are already present in the workspace, but do not assume any hidden oracle or confirmation artifact exists. Identify the most plausible vulnerable file, function, root cause, and supporting evidence. Finish with exactly one JSON object containing predicted_cves, predicted_files, predicted_functions, root_cause, evidence, and confidence."
  },
  "notes": "Lightweight C memory-safety benchmark case for source-level index-validation reasoning.",
  "notes_ref": "docs/cases/giflib.md"
}



